Checked,Status,Unpublished,ID,Label,Alternate Title,Corporate Name,Personal Name,Personal Name Verbose,Place of Publication or Production,Publisher,Date of Publication or Production,Summary,Notes,Topic,Type,Format,Language,Extent,Dimensions,Rights Statement,Library Call Number,Link,Identifier
TRUE,,,CSL00001,Chicano Classification System,CCS,"University of California, Berkeley. Chicano Studies Library","Arce, José Antonio","Arce, José Antonio, 1948-2018","Berkeley, California",,approximately 1972-2001,"Chicano Classification System, first draft, July 1974 by José Antonio Arce, with subsequent additions through approximately 2001. The system is based in part on the Library of Congress Classification System, with specialized expansions and adaptations for use in the Chicano Studies Library.","Includes several insertions and manuscript annotations|Single-sided, with occasional scrap paper content on versos.",Chicano Classification System|Knowledge organization,Classification schemes|Internal documents,integrating resource|text,English,450 pages,8.5 x 11 inches,"Ethnic Studies Library, UC Berkeley",,,
TRUE,,,CSL00002,Prospectus for a Chicano Periodical Index Project,,"University of California, Berkeley. Chicano Studies Library","Chabrán, Richard","Chabrán, Richard","Berkeley, California",,1978,"Budget and project timetable from a prospectus for the Chicano Periodical Index Project, prepared by Richard Chabrán, January 1978.",Incomplete.,Chicano Periodical Index|Knowledge organization,Proposals|Internal documents,text,English,13 pages,8.5 x 11 inches,"Ethnic Studies Library, UC Berkeley",,https://search.library.berkeley.edu/permalink/01UCS_BER/1thfj9n/alma991021951939706532,
TRUE,,,CSL00003,Chicano Studies Library Serials Collection Advertisement,CSL Serials Collection Advertisement,"University of California, Berkeley. Chicano Studies Library",,,"Berkeley, California",,between 1989 and 1992?,"Contents list for section 9, and price list for microfilm sections 1-11, of the Chicano Studies Library Serials Collection; section 12 is listed as forthcoming, December 1992.",,Chicano Serials Collection,Advertisements|Fliers,text,English,3 pages,8.5 x 11 inches,"Ethnic Studies Library, UC Berkeley",,,
TRUE,only title page digitized; update if rest is added,,CSL00004,Chicanas in the 80's: Unsettled Issues (title page),Chicanas in the 1980s|Unsettled Issues,"Mujeres en Marcha (Club)|NACS Conference (11th : 1982 : Tempe, Ariz.) ","Córdova, Teresa|Cuádraz, Gloria|Decierdo, Margarita Arce|González, Deena J.","Córdova, Teresa|Cuádraz, Gloria|Decierdo, Margarita Arce|González, Deena J.","Berkeley, California",Chicano Studies Library Publications Unit,1982,"Title page from the published volume of proceedings from the NACS conference, including transcripts of talks by panel speakers and moderators Teresa Córdova, Gloria Cuádraz, Margarita Decierdo, and Deena González.",Title page only,Chicanas|Chicano Studies Library Publications Unit|Exhibits and events,Conference papers and proceedings,publication|extract|text,English,1 page,8.5 x 5.5 inches,"Ethnic Studies Library, UC Berkeley",HQ1384 .C6,https://search.library.berkeley.edu/permalink/01UCS_BER/1thfj9n/alma991008909099706532,
TRUE,,,CSL00005,Plan for the Development of the Chicano Database,,"University of California, Berkeley. Chicano Studies Library",,,"Berkeley, California",,1993,Outline of plans and steps for the development of the Chicano Database. ,Adhesive note with pencil notes attached,Chicano Database,Internal documents,text,English,1 page,8.5 x 11 inches,"Ethnic Studies Library, UC Berkeley",,,
TRUE,,,CSL00006,Nightly Backup Procedure,,"University of California, Berkeley. Chicano Studies Library","Castillo-Speed, Lillian","Castillo-Speed, Lillian","Berkeley, California",,1984,Procedure document containing instructions for nightly backup of database files.,"Dated December 7, 1984, with additional manuscript notes including one dated July 13, 1987.",Chicano Database|Technologies,Internal documents|Manuals,text,English,1 page,8.5 x 11 inches,"Ethnic Studies Library, UC Berkeley",,,
TRUE,,,CSL00007,Job Vacancy Listing: Chicano Studies Library Coordinator,,"University of California, Berkeley. Chicano Studies Library","Gonzalez, Lila|Armada, Dolores","Gonzalez, Lila, 1929-2013|Armada, Dolores","Berkeley, California",,1975,"Job vacancy listing and job description for the Library Coordinator position at the Chicano Studies Library, reporting to supervisor Lila Gonzalez.",,"University of California, Berkeley. Chicano Studies Library|Library administration",Internal documents|Job postings,form|text,English,3 pages,8.5 x 11 inches,"Ethnic Studies Library, UC Berkeley",,,
TRUE,,,CSL00008,Goals of the Ethnic Studies Libraries,,"University of California, Berkeley. Ethnic Studies Library|University of California, Berkeley. Department of Ethnic Studies",,,"Berkeley, California",,1993,"Goals of the Ethnic Studies Libraries, as adopted by the Ethnic Studies Department, May 13, 1993, including goals and objectives for relocation and merger of the Asian American Studies Library, the Chicano Studies Library, and the Native American Studies Library.",,"University of California, Berkeley. Ethnic Studies Library|Library administration",Internal documents,text,English,1 page,8.5 x 11 inches,"Ethnic Studies Library, UC Berkeley",,,
TRUE,,,CSL00009,Chicano Studies Library Donor Reception Invitation,CSL Donor Reception Invitation,"University of California, Berkeley. Chicano Studies Library|Casa Joaquin Murrieta (Berkeley, Calif.)","Castillo-Speed, Lillian|Garza, Luis Alberto de la|Silva, Benicio|Ortiz, Maria","Castillo-Speed, Lillian|Garza, Luis Alberto de la|Silva, Benicio|Ortiz, Maria","Berkeley, California",,1993,"Invitation and program for a Chicano Studies Library donor reception, recognition ceremony, and dinner. The event was held April 23, 1993 at Casa Joaquin Murrieta, and sponsored by the Chicano Studies Library and the Casa Joaquin Murrieta, and speakers included Benicio Silva, Luis de la Garza, Lillian Castillo-Speed, Maria Ortiz, and several others.",On letterhead for the Chicano Studies Library.,"University of California, Berkeley. Chicano Studies Library|Benefactors|Exhibits and events|Library outreach|Recognition",Invitations|Programs,text,English,2 pages,8.5 x 11 inches,"Ethnic Studies Library, UC Berkeley",,,
TRUE,,,CSL00010,Undocumented Scars Exhibit Publicity Flier,,"University of California, Berkeley. Chicano Studies Library|Sociedad Locura Artística del Barrio","Castillo-Speed, Lillian","Castillo-Speed, Lillian","Berkeley, California",,1993,"Announcement of an exhibit and reception of contemporary Raza art featuring the artists' group Sociedad Locura Artística del Barrio (SLAB). The exhibit was held in the Chicano Studies Library, April 20 through May 31, 1992, and the reception was held at the Unitas Christian Fellowship, May 6. 1993. Artists included Viviana N. Arellano, Alexandro Cbarrubias, Eduardo Espinoza, Ernesto Espinoza, Ramon Ramirez, and Manuel ""Chato"" Salazar. The announcement also gives thanks to Lillian Castillo-Speed and the Chicano Studies Library.",,Chicano art|Arts and literature|Exhibits and events|Recognition|Library outreach,Advertisements|Fliers,text|image,English|Spanish,2 pages,7 x 10 inches,,,,
TRUE,,,CSL00011,"Staff Meeting Minutes, March 3, 1989",,"University of California, Berkeley. Chicano Studies Library","Castillo-Speed, Lillian","Castillo-Speed, Lillian","Berkeley, California",,1989,"Meeting minutes from a staff meeting held March 3, 1989, and run by Lillian Castillo-Speed with six other staff members present.",,"University of California, Berkeley. Chicano Studies Library|Library administration",Internal documents,text,English,4 pages,8.5 x 11 inches,"Ethnic Studies Library, UC Berkeley",,,
TRUE,Duplicate: CSL00091,,CSL00012,"Letter from Wilma Salvatori Torri, September 10, 1974",,"University of California, Berkeley. Chicano Studies Library","Torri, Wilma Salvatori","Torri, Wilma Salvatori","Torino, Italy",,1974,"Letter of thanks from Wilma Salvatori Torri, an Italian student who used the Chicano Studies Library for her thesis research.",,"University of California, Berkeley. Chicano Studies Library|Recognition",Letters,text,English,2 pages,8.5 x 11 inches,"Ethnic Studies Library, UC Berkeley",,,
TRUE,,,CSL00013,"CU News. (Volume 48, Number 22, June 10, 1993)",Weekly Newsletter of the Library,"University of California, Berkeley. Library",,,"Berkeley, California",,1993,"June 10, 1993 issue of the weekly newsletter of the U.C. Berkeley Library. The issue announces a reference tour of the Chicano Studies Library, a position announcement for the Native American Studies Library, and other library events.",,"University of California, Berkeley. Chicano Studies Library|Recognition",Newsletters,text|serial,English,2 pages,8.5 x 11 inches,,,,
TRUE,,,CSL00014,"Letter from Lea Burroughs to Lillian Castillo-Speed, October 30, 1995",,,"Burroughs, Lea|Castillo-Speed, Lillian","Burroughs, Lea|Castillo-Speed, Lillian","San Francisco, California",,1995,"Letter from Lea Burroughs, a writer and librarian in San Francisco to Lillian Castillo-Speed, expressing thanks to the Chicano Studies Library. ",,"University of California, Berkeley. Chicano Studies Library|Recognition",Letters,text,English,1 page,8.5 x 11 inches,"Ethnic Studies Library, UC Berkeley",,,
TRUE,,,CSL00015,Mexican American Biographies (Acknowledgements),,,"Meier, Matt S.","Meier, Matt S.","New York, New York",Greenwood Press,1988,"Extract of acknowledgements from the volume, which mention the Chicano Studies Library. Also includes the title page and table of contents.",,"University of California, Berkeley. Chicano Studies Library|Recognition",,text|extract|publication,English,3 pages,8.5 x 11 inches,,CT268 .M3,https://search.library.berkeley.edu/permalink/01UCS_BER/s4lks2/cdi_proquest_miscellaneous_59465410,
TRUE,,,CSL00016,"Letter from Sherry Levy-Reiner to Lillian Castillo-Speed, July 1, 1991",,Association of American Colleges,"Levy-Reiner, Sherry|Castillo-Speed, Lillian","Levy-Reiner, Sherry|Castillo-Speed, Lillian","Washington, D.C.",,1991,"Letter from Sherry Levy-Reiner, Director of Public Information and Publications at the Association of American Colleges, thanking her for research assistance and sending a copy of an AAC publication which cites the Chicano Database.",,Chicano Database|Recognition,Letters,text,English,1 page,8.5 x 11 inches,"Ethnic Studies Library, UC Berkeley",,,
TRUE,,,CSL00017,"Letters to and from Alexandr Vaschenko, 1997 and 1998",,,"Vashchenko, Aleksandr|Castillo-Speed, Lillian","Vashchenko, A. (Aleksandr)|Castillo-Speed, Lillian","Moscow, Russia|Berkeley, California",,1987|1988,"A letter from Lillian Castillo-Speed to Aleksandr Vashchenko, at the A.M. Gorky Institute of World Literature, Moscow, U.S.S.R., sending six books on Chicano literature, and his reply, thanking Lillian for the books and for his visit to the library. Also includes the envelope and a copy of his CV. ",,"University of California, Berkeley. Chicano Studies Library|Recognition",Letters,text,English,6 pages,8.5 x 11 inches,"Ethnic Studies Library, UC Berkeley",,,
TRUE,,,CSL00018,Chicana Feminist Thought (Acknowledgements),,,"Garcia, Alma M.","Garcia, Alma M.","New York, New York",Routledge,1997,"Extract of acknowledgements from the volume, edited by Alma M. Garcia, mentioning Lillian Castillo-Speed and the Chicano Studies Library.",,"University of California, Berkeley. Chicano Studies Library|Chicanas|Recognition",,text|extract|publication,English,3 pages,8.5 x 11 inches,,HQ1101 .C654 1997,https://search.library.berkeley.edu/permalink/01UCS_BER/1thfj9n/alma991034182399706532,
TRUE,,,CSL00019,Chicano Studies Library Operation/Projects & Staff Assignments,,"University of California, Berkeley. Chicano Studies Library","Arce, José Antonio","Arce, José Antonio, 1948-2018","Berkeley, California",,1975,"Organization chart from summer 1975, for the Chicano Studies Library including department and staff names. ",,"University of California, Berkeley. Chicano Studies Library|Library administration",Organizational charts|Internal documents,text,English,1 page,8.5 x 11 inches,"Ethnic Studies Library, UC Berkeley",,,
TRUE,,,CSL00020,Ernesto Galarza at U.C. Berkeley Flier,The Role of Chicano Graduate Students in Research,"University of California, Berkeley. Chicano Studies Library","Galarza, Ernesto","Galarza, Ernesto, 1905-1984","Berkeley, California",,1977,"Advertisement for a lecture by Ernesto Galarza titled ""The Role of Chicano Graduate Students in Research"" on April 20, 1977 in the Student Union, followed by a reception hosted by the Chicano Studies Library.","Transcript of the lecture was published under the title ""Student's Responsibilities to the Chicano Community"" as part of ""Burning Light: Action and Organizing in the Mexican Community in California"" available at the link.",Chicano students|Arts and literature|Exhibits and events|Recognition|Library outreach,Advertisements|Fliers,text,English,1 page,8.5 x 11 inches,"Ethnic Studies Library, UC Berkeley",,https://oac.cdlib.org/view?docId=hb7g50084v,
TRUE,,,CSL00021,"Imaging Aztlán, Galeria de la Raza Postcard",,"Galería de la Raza (San Francisco, Calif.)",,,"San Francisco, California",,1998,"Postcard for exhibit titled ""Imaging Aztlán"" that was held at Galería de la Raza, San Francisco, California, February 3 to March 14, 1998.",,Chicano art|Exhibits and events|Arts and literature,Advertisements|Postcards,text,English|Spanish,1 page,4 x 6 inches,,,,
TRUE,,,CSL00022,Aspectos de la Literatura Chicana,Aspects of Chicano Literature,"University of California, Berkeley. Chicano Studies Library","Treviño, Oscar|Chabrán, Richard|Ybarra-Frausto, Tomás","Treviño, Oscar|Chabrán, Richard|Ybarra-Frausto, Tomás","Berkeley, California","Chicano Studies Library, University of California",1979,"Bilingual exhibit catalog for an exhibit of Chicano literature. The exhibit was prepared by Richard Chabrán and Oscar Treviño, and the catalog was designed by Oscar Treviño. The introduction was written by Tomás Ybarra-Frausto.",,Chicano literature|Exhibits and events|Arts and literature|Library outreach,Exhibition catalogs,text,English|Spanish,14 pages,8.5 x 11 inches,,, https://search.library.berkeley.edu/permalink/01UCS_BER/1thfj9n/alma991029598169706532,
TRUE,,,CSL00023,Chicano Periodical Index Worksheet,,"University of California, Berkeley. Chicano Studies Library",,,"Berkeley, California",,1978?,A blank template for creating entries in the Chicano Periodical Index.,,Chicano Periodical Index|Knowledge organization,Blank forms|Internal documents,text,English,1 page,8.5 x 11 inches,"Ethnic Studies Library, UC Berkeley",,,
TRUE,,,CSL00024,"Stephens Hall Space Meeting, November 21, 1994",,"University of California, Berkeley. Chicano Studies Library","Castillo-Speed, Lillian","Castillo-Speed, Lillian","Berkeley, California",,1994,Meeting minutes regarding planning for space for the merged Ethnic Studies Library in Stephens Hall,,"University of California, Berkeley. Ethnic Studies Library|Library administration|Library buildings",Meeting minutes,text,English,2 pages,8.5 x 11 inches,"Ethnic Studies Library, UC Berkeley",,,
TRUE,,,CSL00025,"Ground Floor, Stephens Hall: Floor Plan, Revised Jan. 1",,"University of California, Berkeley. Ethnic Studies Library|University of California, Berkeley. Capital Projects",,,"Berkeley, California",,1996?,"Floor plan for the Ethnic Studies Library in Stephens Hall. Stacks, offices, and other functional library spaces indicated in pencil.",,"University of California, Berkeley. Ethnic Studies Library|Library administration|Library buildings",Architectural drawings|Internal documents,image,English,1 page,8.5 x 11 inches,"Ethnic Studies Library, UC Berkeley",,,
TRUE,,,CSL00026,"Letter to Nevil Leimanis, February 7, 1996",,"University of California, Berkeley. Ethnic Studies Library|University of California, Berkeley. Capital Projects","Castillo-Speed, Lillian|Poon, Wei Chi|Young, Mary L.|Leimanis, Nevil","Castillo-Speed, Lillian|Poon, Wei Chi|Young, Mary L.|Leimanis, Nevil","Berkeley, California",,1996,"Letter from Lillian Castillo-Speed, Mary L. Young, and Wei Chi Poon, the heads of the three collections in the Ethnic Studies Library, to Nevil Leimanis, the project manager for renovation of Stephens Hall, regarding specifics of renovations to the library space.",,"University of California, Berkeley. Ethnic Studies Library|Library administration|Library buildings",Letters|Internal documents,text,English,1 page,8.5 x 11 inches,"Ethnic Studies Library, UC Berkeley",,,
TRUE,,,CSL00027,"Chicano Database Review, in ANSS Currents, Volume 19, Number 1, May 2004",ANSS Currents,,"Nalen, James","Nalen, James","Chicago, Illinois",Association of College and Research Libraries. Anthropology & Sociology Section,2004,"Review of the Chicano Database, in an issue of the ANSS Currents newsletter, May 2004. With a fax cover letter from Sharon Vaughn-Lahman to Lillian Castillo-Speed, May 26, 2004.",,Chicano Database|Technologies|Knowledge organization,Reviews|Newsletters,text|serial,English,5 pages,8.5 x 11 inches,,,,
TRUE,,,CSL00028,OCLC Publicity Flier for the Chicano Database,,OCLC,,,"Dublin, Ohio",OCLC,2007,"Publicity flier for the Chicano Database in OCLC FirstSearch, describing features and ordering information for the database. The database migrated from Research Libraries Group’s Eureka service in 2007.",,Chicano Database|Technologies|Knowledge organization,Advertisements|Fliers,text,English,2 pages,8.5 x 11 inches,,,,
TRUE,,,CSL00029,"Letter from Sally H. McCallum to Lillian Castillo-Speed, May 24, 1990",,"Library of Congress. Network Development and MARC Standards Office
","McCallum, Sally H.|Castillo-Speed, Lillian","McCallum, Sally H.|Castillo-Speed, Lillian","Washington, D.C.",,1990,"Letter from Sally McCallum of the Library of Congress Network Development and MARC Standards Office to Lillian Castillo-Speed, concerning the establishment of the official MARC subject heading source code ""cht"" for the Chicano Thesaurus, enabling the thesaurus to be used alongside Library of Congress subject headings in machine-readable catalog records.",,Chicano Thesaurus|Knowledge organization|Technologies,Letters,text,English,1 page,8.5 x 11 inches,"Ethnic Studies Library, UC Berkeley",,,
TRUE,,,CSL00030,"Chicano Studies Library Newsletter (Volume 1, Number 2, June 1985)",CSL Newsletter,"University of California, Berkeley. Chicano Studies Library",,,"Berkeley, California",,1985,An issue of the Chicano Studies Library newsletter from June 1985.,,"University of California, Berkeley. Chicano Studies Library|Library administration|Library outreach",Newsletters,text|serial,English,4 pages,8.5 x 11 inches,"Ethnic Studies Library, UC Berkeley",,https://search.library.berkeley.edu/permalink/01UCS_BER/1thfj9n/alma991005424259706532,
TRUE,,,CSL00031,"Chicano Studies Library Newsletter (Volume 3, Number 1, March 1987)",CSL Newsletter,"University of California, Berkeley. Chicano Studies Library","Castillo-Speed, Lillian|Soto, Carolyn","Castillo-Speed, Lillian|Soto, Carolyn","Berkeley, California",,1987,An issue of the Chicano Studies Library newsletter from March 1987.,,"University of California, Berkeley. Chicano Studies Library|Library administration|Library outreach",Newsletters,text|serial,English,4 pages,8.5 x 11 inches,"Ethnic Studies Library, UC Berkeley",,https://search.library.berkeley.edu/permalink/01UCS_BER/1thfj9n/alma991005424259706532,
TRUE,,,CSL00032,"Chicano Studies Library Newsletter (Volume 2, Number 1, February 1986)",CSL Newsletter,"University of California, Berkeley. Chicano Studies Library",,,"Berkeley, California",,1986,An issue of the Chicano Studies Library newsletter from February 1986.,,"University of California, Berkeley. Chicano Studies Library|Library administration|Library outreach",Newsletters,text|serial,English,5 pages,8.5 x 11 inches,"Ethnic Studies Library, UC Berkeley",,https://search.library.berkeley.edu/permalink/01UCS_BER/1thfj9n/alma991005424259706532,
TRUE,,,CSL00033,"Chicano Studies Library Newsletter (Volume 4, Number 2, May 1989)",CSL Newsletter,"University of California, Berkeley. Chicano Studies Library","Castillo-Speed, Lillian|Soto, Carolyn","Castillo-Speed, Lillian|Soto, Carolyn","Berkeley, California",,1989,An issue of the Chicano Studies Library newsletter from May 1989.,,"University of California, Berkeley. Chicano Studies Library|Library administration|Library outreach",Newsletters,text|serial,English,4 pages,8.5 x 11 inches,"Ethnic Studies Library, UC Berkeley",,https://search.library.berkeley.edu/permalink/01UCS_BER/1thfj9n/alma991005424259706532,
TRUE,,,CSL00034,"Chicano Studies Library Newsletter (Volume 5, Number 1, February 1991)",CSL Newsletter,"University of California, Berkeley. Chicano Studies Library","Castillo-Speed, Lillian|Soto, Carolyn","Castillo-Speed, Lillian|Soto, Carolyn","Berkeley, California",,1991,An issue of the Chicano Studies Library newsletter from February 1991.,,"University of California, Berkeley. Chicano Studies Library|Library administration|Library outreach",Newsletters,text|serial,English,5 pages,8.5 x 11 inches,"Ethnic Studies Library, UC Berkeley",,https://search.library.berkeley.edu/permalink/01UCS_BER/1thfj9n/alma991005424259706532,
TRUE,See also CSL00065 (earlier draft),,CSL00035,Chicano Database Indexing Manual,Chicano Periodical Index Processing Manual,"University of California, Berkeley. Chicano Studies Library","Chabrán, Richard|García-Ayvens, Francisco|Castillo-Speed, Lillian","Chabrán, Richard|García-Ayvens, Francisco, 1948-2018|Castillo-Speed, Lillian","Berkeley, California",,2003,"A processing manual for the Chicano Periodical Index, compiled by Richard Chabrán and Francisco García-Ayvens, and subsequently revised by Lillian Castillo-Speed, including several handwritten annotations.",,Chicano Database|Chicano Periodical Index|Chicano Serials Collection|Technologies,Manuals|Internal documents,text,English,9 pages,8.5 x 11 inches,"Ethnic Studies Library, UC Berkeley",,,
TRUE,,,CSL00036,Chicano Database Worksheet - Books,,"University of California, Berkeley. Chicano Studies Library",,,"Berkeley, California",,2003?,A blank template for creating entries for books in the Chicano Database,,Chicano Database|Knowledge organization|Technologies,Blank forms|Internal documents,text,English,1 page,8.5 x 11 inches,"Ethnic Studies Library, UC Berkeley",,,
TRUE,,,CSL00037,EBSCO Publicity Flier for Chicano Database,,EBSCO Industries,,,"Birmingham, Alabama",EBSCO,2015,"An advertisement for the Chicano Database via EBSCO, including description of features and how to order. The database was first licensed by EBSCO in 2012.",,Chicano Database|Technologies,Advertisements|Fliers,text,English,1 page,8.5 x 11 inches,,,,
TRUE,,,CSL00038,Chicano Thesaurus Revision Project Sponsored by LAUC,List of LGBTIQ Terms Added to the Chicano Thesaurus,University of California (System). Librarians Association,,,"Berkeley, California",,2007,"List of terms relating to Lesbian, Gay, Bisexual, Intersex and Queer people, which were added to the Chicano Thesaurus as part of a revision project sponsored by the Librarians Association of the University of California (LUAC)",,Chicano Thesaurus|LGBTQI people|Knowledge organization,Controlled vocabularies,text,English,3 pages,8.5 x 11 inches,,,,
TRUE,,,CSL00039,LAUC Research Project to Revise the Chicano Thesaurus,List of Non Chicano People of Latino Heritage,University of California (System). Librarians Association,,,"Berkeley, California",,2007,"List of demographic terms for non-Chicano people of Latino heritage, which were added to the Chicano Thesaurus as part of a revision project sponsored by the Librarians Association of the University of California (LUAC)",,Chicano Thesaurus|Latin Americans|Knowledge organization,Controlled vocabularies,text,English,6 pages,8.5 x 11 inches,,,,
TRUE,,,CSL00040,Chicano Database: Manufacturing Disc,"Chicano Database, July 2020",,,,"Gilroy, California",Knowledge Access Publishing,2000,"A CD-ROM disc for the Chicano Database, from July 2000",,Chicano Database|Technologies,CD-ROMs,CD-ROM,English,1 disc,5 x 5 inches,"Ethnic Studies Library, UC Berkeley",,,
TRUE,,,CSL00041,Chicano Studies Library Publications ,,"University of California, Berkeley. Chicano Studies Library",,,"Berkeley, California",Chicano Studies Library Publications Unit,1991,"Catalogue of publications available from the Chicano Studies Library Publications Unit, with an order form.",,"University of California, Berkeley. Chicano Studies Library. Publications Unit",Publishers' catalogs,text,English,4 pages,17 x 11 inches,"Ethnic Studies Library, UC Berkeley",,,
TRUE,,,CSL00042,Chicano Anthology Index Flier,,"University of California, Berkeley. Chicano Studies Library",,,"Berkeley, California",Chicano Studies Library Publications Unit,1991,"Advertisement and order form for the Chicano Anthology Index, edited by Francisco García-Ayvens.",,"Chicano Anthology Index|University of California, Berkeley. Chicano Studies Library. Publications Unit",Advertisements|Fliers,text,English,1 page,8.5 x 11 inches,"Ethnic Studies Library, UC Berkeley",,,
